{
  "collection": "degents",
  "source": "bundled",
  "certified": false,
  "blockWeightLimitWU": 4000000,
  "fullBlockTierMinBytes": 3500000,
  "count": 8,
  "items": [
    {
      "number": 2770,
      "id": "d4660712cd5241e2df663a3d503bf322235b15a954e5c6c434ad728c0fce0026i0",
      "name": "Degent #2770",
      "tier": "fullblock",
      "lane": "block",
      "contentBytes": 3962660,
      "revealWeightWU": 3986062,
      "revealVsize": 996516,
      "blockWeightLimitWU": 4000000,
      "blockFraction": 0.9965155,
      "feeRate": null,
      "facts": {
        "timestamp": null,
        "height": null,
        "feeSats": null,
        "address": null,
        "contentType": null
      },
      "estimated": true,
      "links": {
        "ordinals": "https://ordinals.com/inscription/d4660712cd5241e2df663a3d503bf322235b15a954e5c6c434ad728c0fce0026i0",
        "ordiscan": "https://ordiscan.com/inscription/d4660712cd5241e2df663a3d503bf322235b15a954e5c6c434ad728c0fce0026i0",
        "magicEden": "https://magiceden.io/ordinals/item-details/d4660712cd5241e2df663a3d503bf322235b15a954e5c6c434ad728c0fce0026i0",
        "xray": "https://block.space/xray/d4660712cd5241e2df663a3d503bf322235b15a954e5c6c434ad728c0fce0026",
        "theater": null
      }
    },
    {
      "number": 2709,
      "id": "f3bb4f2e06066623d57db84a2ff1f9e68f035212a931e0c5861823703b0e9363i0",
      "name": "Degent #2709",
      "tier": "fullblock",
      "lane": "block",
      "contentBytes": 3954190,
      "revealWeightWU": 3977543,
      "revealVsize": 994386,
      "blockWeightLimitWU": 4000000,
      "blockFraction": 0.99438575,
      "feeRate": null,
      "facts": {
        "timestamp": null,
        "height": null,
        "feeSats": null,
        "address": null,
        "contentType": null
      },
      "estimated": true,
      "links": {
        "ordinals": "https://ordinals.com/inscription/f3bb4f2e06066623d57db84a2ff1f9e68f035212a931e0c5861823703b0e9363i0",
        "ordiscan": "https://ordiscan.com/inscription/f3bb4f2e06066623d57db84a2ff1f9e68f035212a931e0c5861823703b0e9363i0",
        "magicEden": "https://magiceden.io/ordinals/item-details/f3bb4f2e06066623d57db84a2ff1f9e68f035212a931e0c5861823703b0e9363i0",
        "xray": "https://block.space/xray/f3bb4f2e06066623d57db84a2ff1f9e68f035212a931e0c5861823703b0e9363",
        "theater": null
      }
    },
    {
      "number": 2737,
      "id": "4b3e2faa0a8547362a562f01dc522e185bf14727eeefc4ff06da02f76e0ca5dbi0",
      "name": "Degent #2737",
      "tier": "fullblock",
      "lane": "block",
      "contentBytes": 3951980,
      "revealWeightWU": 3975319,
      "revealVsize": 993830,
      "blockWeightLimitWU": 4000000,
      "blockFraction": 0.99382975,
      "feeRate": null,
      "facts": {
        "timestamp": null,
        "height": null,
        "feeSats": null,
        "address": null,
        "contentType": null
      },
      "estimated": true,
      "links": {
        "ordinals": "https://ordinals.com/inscription/4b3e2faa0a8547362a562f01dc522e185bf14727eeefc4ff06da02f76e0ca5dbi0",
        "ordiscan": "https://ordiscan.com/inscription/4b3e2faa0a8547362a562f01dc522e185bf14727eeefc4ff06da02f76e0ca5dbi0",
        "magicEden": "https://magiceden.io/ordinals/item-details/4b3e2faa0a8547362a562f01dc522e185bf14727eeefc4ff06da02f76e0ca5dbi0",
        "xray": "https://block.space/xray/4b3e2faa0a8547362a562f01dc522e185bf14727eeefc4ff06da02f76e0ca5db",
        "theater": null
      }
    },
    {
      "number": 2720,
      "id": "1ca3e0829d5e9a9891fb3b0afb8af4458d6b5a5b9b31139b786d7a322f8c4b78i0",
      "name": "Degent #2720",
      "tier": "fullblock",
      "lane": "block",
      "contentBytes": 3946670,
      "revealWeightWU": 3969979,
      "revealVsize": 992495,
      "blockWeightLimitWU": 4000000,
      "blockFraction": 0.99249475,
      "feeRate": null,
      "facts": {
        "timestamp": null,
        "height": null,
        "feeSats": null,
        "address": null,
        "contentType": null
      },
      "estimated": true,
      "links": {
        "ordinals": "https://ordinals.com/inscription/1ca3e0829d5e9a9891fb3b0afb8af4458d6b5a5b9b31139b786d7a322f8c4b78i0",
        "ordiscan": "https://ordiscan.com/inscription/1ca3e0829d5e9a9891fb3b0afb8af4458d6b5a5b9b31139b786d7a322f8c4b78i0",
        "magicEden": "https://magiceden.io/ordinals/item-details/1ca3e0829d5e9a9891fb3b0afb8af4458d6b5a5b9b31139b786d7a322f8c4b78i0",
        "xray": "https://block.space/xray/1ca3e0829d5e9a9891fb3b0afb8af4458d6b5a5b9b31139b786d7a322f8c4b78",
        "theater": null
      }
    },
    {
      "number": 2650,
      "id": "8019cc6ad912e9207f760e9fa27a7b37f7f8b6dd58dd2f2a6456635a8e1cbcbfi0",
      "name": "Degent #2650",
      "tier": "fullblock",
      "lane": "block",
      "contentBytes": 3919330,
      "revealWeightWU": 3942482,
      "revealVsize": 985621,
      "blockWeightLimitWU": 4000000,
      "blockFraction": 0.9856205,
      "feeRate": null,
      "facts": {
        "timestamp": null,
        "height": null,
        "feeSats": null,
        "address": null,
        "contentType": null
      },
      "estimated": true,
      "links": {
        "ordinals": "https://ordinals.com/inscription/8019cc6ad912e9207f760e9fa27a7b37f7f8b6dd58dd2f2a6456635a8e1cbcbfi0",
        "ordiscan": "https://ordiscan.com/inscription/8019cc6ad912e9207f760e9fa27a7b37f7f8b6dd58dd2f2a6456635a8e1cbcbfi0",
        "magicEden": "https://magiceden.io/ordinals/item-details/8019cc6ad912e9207f760e9fa27a7b37f7f8b6dd58dd2f2a6456635a8e1cbcbfi0",
        "xray": "https://block.space/xray/8019cc6ad912e9207f760e9fa27a7b37f7f8b6dd58dd2f2a6456635a8e1cbcbf",
        "theater": null
      }
    },
    {
      "number": 2652,
      "id": "fb0c95f1938566d3666bed3704de43f3c34db7f7745ef228eae9f875a00045d6i0",
      "name": "Degent #2652",
      "tier": "fullblock",
      "lane": "block",
      "contentBytes": 3915050,
      "revealWeightWU": 3938176,
      "revealVsize": 984544,
      "blockWeightLimitWU": 4000000,
      "blockFraction": 0.984544,
      "feeRate": null,
      "facts": {
        "timestamp": null,
        "height": null,
        "feeSats": null,
        "address": null,
        "contentType": null
      },
      "estimated": true,
      "links": {
        "ordinals": "https://ordinals.com/inscription/fb0c95f1938566d3666bed3704de43f3c34db7f7745ef228eae9f875a00045d6i0",
        "ordiscan": "https://ordiscan.com/inscription/fb0c95f1938566d3666bed3704de43f3c34db7f7745ef228eae9f875a00045d6i0",
        "magicEden": "https://magiceden.io/ordinals/item-details/fb0c95f1938566d3666bed3704de43f3c34db7f7745ef228eae9f875a00045d6i0",
        "xray": "https://block.space/xray/fb0c95f1938566d3666bed3704de43f3c34db7f7745ef228eae9f875a00045d6",
        "theater": null
      }
    },
    {
      "number": 2651,
      "id": "997e2d19f2c5289b063786a72ea7914b7bb7ab015b1fc0ce145ae4d30bf86f50i0",
      "name": "Degent #2651",
      "tier": "fullblock",
      "lane": "block",
      "contentBytes": 3913540,
      "revealWeightWU": 3936658,
      "revealVsize": 984165,
      "blockWeightLimitWU": 4000000,
      "blockFraction": 0.9841645,
      "feeRate": null,
      "facts": {
        "timestamp": null,
        "height": null,
        "feeSats": null,
        "address": null,
        "contentType": null
      },
      "estimated": true,
      "links": {
        "ordinals": "https://ordinals.com/inscription/997e2d19f2c5289b063786a72ea7914b7bb7ab015b1fc0ce145ae4d30bf86f50i0",
        "ordiscan": "https://ordiscan.com/inscription/997e2d19f2c5289b063786a72ea7914b7bb7ab015b1fc0ce145ae4d30bf86f50i0",
        "magicEden": "https://magiceden.io/ordinals/item-details/997e2d19f2c5289b063786a72ea7914b7bb7ab015b1fc0ce145ae4d30bf86f50i0",
        "xray": "https://block.space/xray/997e2d19f2c5289b063786a72ea7914b7bb7ab015b1fc0ce145ae4d30bf86f50",
        "theater": null
      }
    },
    {
      "number": 2653,
      "id": "433403425c1e94811db468217abb7c7db4d7e0a4b825348055ebd208bd04972ai0",
      "name": "Degent #2653",
      "tier": "fullblock",
      "lane": "block",
      "contentBytes": 3888770,
      "revealWeightWU": 3911745,
      "revealVsize": 977937,
      "blockWeightLimitWU": 4000000,
      "blockFraction": 0.97793625,
      "feeRate": null,
      "facts": {
        "timestamp": null,
        "height": null,
        "feeSats": null,
        "address": null,
        "contentType": null
      },
      "estimated": true,
      "links": {
        "ordinals": "https://ordinals.com/inscription/433403425c1e94811db468217abb7c7db4d7e0a4b825348055ebd208bd04972ai0",
        "ordiscan": "https://ordiscan.com/inscription/433403425c1e94811db468217abb7c7db4d7e0a4b825348055ebd208bd04972ai0",
        "magicEden": "https://magiceden.io/ordinals/item-details/433403425c1e94811db468217abb7c7db4d7e0a4b825348055ebd208bd04972ai0",
        "xray": "https://block.space/xray/433403425c1e94811db468217abb7c7db4d7e0a4b825348055ebd208bd04972a",
        "theater": null
      }
    }
  ]
}
